{
  "schema_version": "0.1.0",
  "mode": "synthetic_fixture",
  "run_id": "demo-0c3342530d684ad6",
  "question": "Which existing coastal plant records could support linking genotype and expression evidence to organismal traits and historical habitat context?",
  "revision": 1,
  "status": "abstained",
  "inputs": {
    "question": "Which existing coastal plant records could support linking genotype and expression evidence to organismal traits and historical habitat context?",
    "focus": "cross-scale",
    "scenario": "future-leakage",
    "max_steps": 30
  },
  "plan": {
    "question": "Which existing coastal plant records could support linking genotype and expression evidence to organismal traits and historical habitat context?",
    "focus": "cross-scale",
    "scenario": "future-leakage",
    "max_steps": 30,
    "selected_sources": [
      "eol",
      "ncbi_genotype",
      "geo",
      "alphaearth",
      "pubmed"
    ],
    "planner": "bounded_rule_based_fixture_planner",
    "mode": "synthetic_fixture",
    "external_actions": false,
    "purpose": "Inspect candidate metadata links; no biological inference or analysis"
  },
  "parent_digest": null,
  "history": [],
  "graph": {
    "nodes": [
      {
        "id": "question",
        "kind": "question",
        "label": "Which existing coastal plant records could support linking genotype and expression evidence to organismal traits and historical habitat context?",
        "status": "completed"
      },
      {
        "id": "policy:eol",
        "kind": "policy",
        "label": "Check access: eol",
        "status": "completed",
        "source_id": "eol",
        "details": {
          "decision": {
            "status": "allow",
            "reasons": [
              "Request satisfies the supplied synthetic policy for offline simulation."
            ],
            "obligations": {
              "decision_scope": "synthetic_offline_fixture_only",
              "live_access_granted": false,
              "audit_required": true,
              "policy_authority": "data_custodian",
              "policy_id": "demo:policy:eol",
              "policy_version": "0.1.0",
              "compute_locations": [
                "source"
              ],
              "allowed_egress": [
                "metadata"
              ],
              "max_bytes": 10000,
              "max_retention_days": 30,
              "required_attribution": [
                "eol:synthetic_fixture"
              ],
              "authorization_required": false
            }
          }
        }
      },
      {
        "id": "source:eol",
        "kind": "source",
        "label": "Encyclopedia of Life: trait context",
        "status": "completed",
        "source_id": "eol",
        "details": {
          "record": {
            "record_id": "demo:eol",
            "taxon_id": "demo:coastal-plant",
            "specimen_id": null,
            "site_id": null,
            "period_end": "2020-12-31",
            "available_at": "2021-06-01",
            "forecast_cutoff": "2022-01-01",
            "evidence": {
              "source": "synthetic_fixture",
              "method": "explicit-field",
              "span": "Invented coastal plant metadata for software testing only."
            },
            "origin": "synthetic_fixture",
            "source_uri": "fixture://eol"
          },
          "record_digest": "45ea6b51290c06e4b5380ec33aaffcc2e744941f19c21ad9acfb497c5866555a",
          "skill": "metadata.inspect@0.1.0"
        }
      },
      {
        "id": "policy:ncbi_genotype",
        "kind": "policy",
        "label": "Check access: ncbi_genotype",
        "status": "completed",
        "source_id": "ncbi_genotype",
        "details": {
          "decision": {
            "status": "allow",
            "reasons": [
              "Request satisfies the supplied synthetic policy for offline simulation."
            ],
            "obligations": {
              "decision_scope": "synthetic_offline_fixture_only",
              "live_access_granted": false,
              "audit_required": true,
              "policy_authority": "data_custodian",
              "policy_id": "demo:policy:ncbi_genotype",
              "policy_version": "0.1.0",
              "compute_locations": [
                "source"
              ],
              "allowed_egress": [
                "metadata"
              ],
              "max_bytes": 10000,
              "max_retention_days": 30,
              "required_attribution": [
                "ncbi_genotype:synthetic_fixture"
              ],
              "authorization_required": false
            }
          }
        }
      },
      {
        "id": "source:ncbi_genotype",
        "kind": "source",
        "label": "NCBI: genotype study metadata",
        "status": "completed",
        "source_id": "ncbi_genotype",
        "details": {
          "record": {
            "record_id": "demo:ncbi_genotype",
            "taxon_id": "demo:coastal-plant",
            "specimen_id": "demo:specimen-1",
            "site_id": null,
            "period_end": "2020-12-31",
            "available_at": "2021-06-01",
            "forecast_cutoff": "2022-01-01",
            "evidence": {
              "source": "synthetic_fixture",
              "method": "explicit-field",
              "span": "Invented coastal plant metadata for software testing only."
            },
            "origin": "synthetic_fixture",
            "source_uri": "fixture://ncbi_genotype"
          },
          "record_digest": "f9bb3eed54681cb7ebf646d8b9b1b587e6288dc4b11ff76a2592e8c3a5677747",
          "skill": "metadata.inspect@0.1.0"
        }
      },
      {
        "id": "policy:geo",
        "kind": "policy",
        "label": "Check access: geo",
        "status": "completed",
        "source_id": "geo",
        "details": {
          "decision": {
            "status": "allow",
            "reasons": [
              "Request satisfies the supplied synthetic policy for offline simulation."
            ],
            "obligations": {
              "decision_scope": "synthetic_offline_fixture_only",
              "live_access_granted": false,
              "audit_required": true,
              "policy_authority": "data_custodian",
              "policy_id": "demo:policy:geo",
              "policy_version": "0.1.0",
              "compute_locations": [
                "source"
              ],
              "allowed_egress": [
                "metadata"
              ],
              "max_bytes": 10000,
              "max_retention_days": 30,
              "required_attribution": [
                "geo:synthetic_fixture"
              ],
              "authorization_required": false
            }
          }
        }
      },
      {
        "id": "source:geo",
        "kind": "source",
        "label": "GEO: expression study metadata",
        "status": "completed",
        "source_id": "geo",
        "details": {
          "record": {
            "record_id": "demo:geo",
            "taxon_id": "demo:coastal-plant",
            "specimen_id": "demo:specimen-1",
            "site_id": "demo:coastal-site-1",
            "period_end": "2020-12-31",
            "available_at": "2021-06-01",
            "forecast_cutoff": "2022-01-01",
            "evidence": {
              "source": "synthetic_fixture",
              "method": "explicit-field",
              "span": "Invented coastal plant metadata for software testing only."
            },
            "origin": "synthetic_fixture",
            "source_uri": "fixture://geo"
          },
          "record_digest": "e0aa16eba331be807edd71cb933542cf2eb701c906b06c537409c013694832d7",
          "skill": "metadata.inspect@0.1.0"
        }
      },
      {
        "id": "policy:alphaearth",
        "kind": "policy",
        "label": "Check access: alphaearth",
        "status": "completed",
        "source_id": "alphaearth",
        "details": {
          "decision": {
            "status": "allow",
            "reasons": [
              "Request satisfies the supplied synthetic policy for offline simulation."
            ],
            "obligations": {
              "decision_scope": "synthetic_offline_fixture_only",
              "live_access_granted": false,
              "audit_required": true,
              "policy_authority": "data_custodian",
              "policy_id": "demo:policy:alphaearth",
              "policy_version": "0.1.0",
              "compute_locations": [
                "source"
              ],
              "allowed_egress": [
                "metadata"
              ],
              "max_bytes": 10000,
              "max_retention_days": 30,
              "required_attribution": [
                "alphaearth:synthetic_fixture"
              ],
              "authorization_required": false
            }
          }
        }
      },
      {
        "id": "source:alphaearth",
        "kind": "source",
        "label": "AlphaEarth: annual landscape context",
        "status": "completed",
        "source_id": "alphaearth",
        "details": {
          "record": {
            "record_id": "demo:alphaearth",
            "taxon_id": "demo:coastal-plant",
            "specimen_id": null,
            "site_id": "demo:coastal-site-1",
            "period_end": "2022-12-31",
            "available_at": "2023-06-01",
            "forecast_cutoff": "2022-01-01",
            "evidence": {
              "source": "synthetic_fixture",
              "method": "explicit-field",
              "span": "Invented coastal plant metadata for software testing only."
            },
            "origin": "synthetic_fixture",
            "source_uri": "fixture://alphaearth"
          },
          "record_digest": "29cc171a27f1710bbad07668f2ac61cc6ce41ad228ff83a0bc898bb75c24e992",
          "skill": "metadata.inspect@0.1.0"
        }
      },
      {
        "id": "policy:pubmed",
        "kind": "policy",